{
  "$schema": "https://json-schema.org/draft/2020-12/schema",
  "$id": "https://flowmirror.example/schemas/run.schema.json",
  "title": "FlowMirror run configuration (M0+)",
  "description": "One simulation run. Optional keys: strategy_groups, channels (defaults documented in config/engine_defaults.yaml), force_arm, modality_level, modality_arms, modality_run_arm, fees (defaults in config/engine_defaults.yaml), arm_level and p_image (LEGACY keys, kept for backward compatibility and no longer required: world.py maps arm_level to modality_level when modality_level is absent, and p_image is superseded by the modality arms), mock_options (REQUIRED only when mock_llm is true -- enforced by allOf below; a live run must not carry mock-only fields), agent_policy and null_params (Card C rule-based null policy; defaults in config/engine_defaults.yaml), and any key starting with '_' (e.g. _what, _generated_from). CLI-only runtime switches are deliberately NOT schema keys: --dump-prompt travels in the engine's separate runtime-options object (flowmirror.engine.loop.RuntimeOpts, card R2D) and never through this validated config, so a literal 'dump_prompt' key handwritten into a run config is rejected on purpose (additionalProperties: false).",
  "type": "object",
  "properties": {
    "run_tag": {
      "type": "string",
      "pattern": "^[A-Za-z0-9_\\-]+$"
    },
    "seed": {
      "type": "integer"
    },
    "mock_llm": {
      "description": "When true, mock_options becomes required (see allOf).",
      "type": "boolean"
    },
    "agent_policy": {
      "description": "Decision source for every agent: 'llm' (live/mock caller) or 'null' (flowmirror.agents.null_policy.NullPolicyLLM; wins over mock_llm). Parameters in null_params are PREREGISTERED (PREREG v1.5 draft section F, forbidden item 12): fix them before seeing main-grid results.",
      "type": "string",
      "enum": [
        "llm",
        "null"
      ],
      "default": "llm"
    },
    "null_params": {
      "description": "Rule parameters for the null policy (Card C); all scalar keys are numbers, stance_probs carries the three stance probabilities. Defaults live in config/engine_defaults.yaml.",
      "type": "object",
      "properties": {
        "p_redeem_gain": {
          "type": "number",
          "minimum": 0,
          "maximum": 1
        },
        "p_redeem_loss": {
          "type": "number",
          "minimum": 0,
          "maximum": 1
        },
        "redeem_pct": {
          "type": "number",
          "minimum": 0,
          "maximum": 100
        },
        "p_sub_base": {
          "type": "number",
          "minimum": 0,
          "maximum": 1
        },
        "chase_slope": {
          "type": "number",
          "minimum": 0
        },
        "sub_pct": {
          "type": "number",
          "minimum": 0,
          "maximum": 100
        },
        "p_sign_mismatch": {
          "type": "number",
          "minimum": 0,
          "maximum": 1
        },
        "p_like": {
          "type": "number",
          "minimum": 0,
          "maximum": 1
        },
        "p_save": {
          "type": "number",
          "minimum": 0,
          "maximum": 1
        },
        "p_follow": {
          "type": "number",
          "minimum": 0,
          "maximum": 1
        },
        "p_comment": {
          "type": "number",
          "minimum": 0,
          "maximum": 1
        },
        "stance_probs": {
          "type": "object",
          "properties": {
            "bullish": {
              "type": "number",
              "minimum": 0,
              "maximum": 1
            },
            "bearish": {
              "type": "number",
              "minimum": 0,
              "maximum": 1
            },
            "watching": {
              "type": "number",
              "minimum": 0,
              "maximum": 1
            }
          },
          "required": [
            "bullish",
            "bearish",
            "watching"
          ],
          "additionalProperties": false
        }
      },
      "additionalProperties": false
    },
    "window": {
      "type": "object",
      "properties": {
        "start": {
          "type": "string",
          "pattern": "^\\d{4}-\\d{2}-\\d{2}$",
          "format": "date"
        },
        "end": {
          "type": "string",
          "pattern": "^\\d{4}-\\d{2}-\\d{2}$",
          "format": "date"
        },
        "max_trading_days": {
          "type": "integer",
          "minimum": 1
        }
      },
      "required": [
        "start",
        "end",
        "max_trading_days"
      ],
      "additionalProperties": false
    },
    "n_agents": {
      "type": "integer",
      "minimum": 1
    },
    "agents_file": {
      "type": "string"
    },
    "orgs": {
      "type": "array",
      "items": {
        "type": "string"
      },
      "minItems": 1
    },
    "content_pool": {
      "type": "string"
    },
    "posts_per_org_per_day": {
      "type": "integer",
      "minimum": 0
    },
    "no_repeat_days": {
      "type": "integer",
      "minimum": 0
    },
    "nav_cache": {
      "type": "string"
    },
    "guba_signal": {
      "type": "string"
    },
    "suitability": {
      "type": "boolean"
    },
    "strategy_mix": {
      "description": "Named mix, or explicit I1/I2/I3 weights summing to ~1.",
      "oneOf": [
        {
          "type": "string",
          "enum": [
            "measured",
            "push_heavy",
            "edu_heavy"
          ]
        },
        {
          "type": "object",
          "properties": {
            "I1": {
              "type": "number"
            },
            "I2": {
              "type": "number"
            },
            "I3": {
              "type": "number"
            }
          },
          "required": [
            "I1",
            "I2",
            "I3"
          ],
          "additionalProperties": false
        }
      ]
    },
    "ranking": {
      "type": "string",
      "enum": [
        "three_source",
        "random"
      ]
    },
    "arm_level": {
      "description": "LEGACY, optional: alias for modality_level from the pre-modality-arm era (world.py maps it when modality_level is absent). No longer required.",
      "type": "string",
      "enum": [
        "agent",
        "exposure",
        "day",
        "post"
      ]
    },
    "modality_level": {
      "description": "Assignment level for modality arms; arm_level is the legacy alias used when this key is absent.",
      "type": "string",
      "enum": [
        "agent",
        "run",
        "exposure"
      ]
    },
    "modality_arms": {
      "description": "Non-empty unique subset of {T, TC, TV}.",
      "type": "array",
      "items": {
        "type": "string",
        "enum": [
          "T",
          "TC",
          "TV"
        ]
      },
      "minItems": 1,
      "uniqueItems": true
    },
    "modality_run_arm": {
      "description": "Arm applied to every agent when modality_level == 'run'; must appear in modality_arms.",
      "type": "string",
      "enum": [
        "T",
        "TC",
        "TV"
      ]
    },
    "fees": {
      "description": "Subscription/redemption fee rates in [0, 0.1].",
      "type": "object",
      "properties": {
        "subscribe_rate": {
          "type": "number",
          "minimum": 0,
          "maximum": 0.1
        },
        "redeem_rate": {
          "type": "number",
          "minimum": 0,
          "maximum": 0.1
        }
      },
      "required": [
        "subscribe_rate",
        "redeem_rate"
      ],
      "additionalProperties": false
    },
    "p_image": {
      "description": "LEGACY, optional: image probability superseded by modality_arms (the TV arm); kept for backward compatibility. No longer required.",
      "type": "number",
      "minimum": 0,
      "maximum": 1
    },
    "climate_weighting": {
      "type": "boolean"
    },
    "memory": {
      "type": "boolean"
    },
    "social": {
      "type": "boolean"
    },
    "feed": {
      "type": "object",
      "additionalProperties": false,
      "required": [
        "K",
        "slots",
        "w_trust",
        "w_fit",
        "w_heat",
        "w_soc",
        "eps",
        "gamma"
      ],
      "properties": {
        "K": {
          "type": "integer",
          "minimum": 1
        },
        "slots": {
          "type": "object",
          "additionalProperties": false,
          "required": [
            "follow",
            "fit",
            "trending"
          ],
          "properties": {
            "follow": {
              "type": "integer",
              "minimum": 0
            },
            "fit": {
              "type": "integer",
              "minimum": 0
            },
            "trending": {
              "type": "integer",
              "minimum": 0
            }
          }
        },
        "w_trust": {
          "type": "number"
        },
        "w_fit": {
          "type": "number"
        },
        "w_heat": {
          "type": "number"
        },
        "w_soc": {
          "type": "number"
        },
        "eps": {
          "type": "number"
        },
        "gamma": {
          "type": "number"
        }
      }
    },
    "p_active": {
      "type": "number",
      "minimum": 0,
      "maximum": 1
    },
    "memory_days": {
      "type": "integer"
    },
    "reflection_every_days": {
      "type": "integer"
    },
    "llm": {
      "type": "object",
      "properties": {
        "model": {
          "type": "string"
        },
        "text_model": {
          "type": "string"
        },
        "workers": {
          "type": "integer",
          "minimum": 1
        },
        "max_attempts": {
          "type": "integer",
          "minimum": 1
        },
        "decision_failure_halt": {
          "type": "number",
          "minimum": 0,
          "maximum": 1
        },
        "cache": {
          "type": "string"
        },
        "max_tokens_start": {
          "type": "integer",
          "minimum": 256
        }
      },
      "required": [
        "model",
        "text_model",
        "workers",
        "max_attempts",
        "decision_failure_halt",
        "cache"
      ],
      "additionalProperties": false
    },
    "mock_options": {
      "description": "MockLLM options; REQUIRED iff mock_llm is true (enforced by allOf below). A live (non-mock) run must not carry these mock-only fields.",
      "type": "object",
      "properties": {
        "force_c2_r4_click": {
          "type": "boolean"
        },
        "malformed_rate": {
          "type": "number",
          "minimum": 0,
          "maximum": 1
        }
      },
      "required": [
        "force_c2_r4_click",
        "malformed_rate"
      ],
      "additionalProperties": false
    },
    "out_dir": {
      "type": "string"
    },
    "strategy_groups": {
      "type": "object",
      "properties": {
        "push_heavy": {
          "type": "array",
          "items": {
            "type": "string"
          }
        },
        "edu_heavy": {
          "type": "array",
          "items": {
            "type": "string"
          }
        },
        "_rule": {
          "type": "string"
        }
      },
      "additionalProperties": false
    },
    "channels": {
      "type": "object",
      "description": "Only typed here; default values (all true except trend/direct) live in config/engine_defaults.yaml.",
      "properties": {
        "feed": {
          "type": "boolean"
        },
        "experience": {
          "type": "boolean"
        },
        "trend": {
          "type": "boolean"
        },
        "social": {
          "type": "boolean"
        },
        "news": {
          "type": "boolean"
        },
        "direct": {
          "type": "boolean"
        }
      },
      "additionalProperties": false
    },
    "force_arm": {
      "type": "string",
      "enum": [
        "T",
        "TV"
      ]
    },
    "scenario": {
      "type": "string",
      "description": "Path to a scenario.yaml bundle."
    },
    "fund_meta_file": {
      "type": "string"
    },
    "family_file": {
      "type": "string"
    }
  },
  "required": [
    "run_tag",
    "seed",
    "mock_llm",
    "window",
    "n_agents",
    "agents_file",
    "orgs",
    "content_pool",
    "posts_per_org_per_day",
    "no_repeat_days",
    "nav_cache",
    "guba_signal",
    "suitability",
    "strategy_mix",
    "ranking",
    "climate_weighting",
    "memory",
    "social",
    "feed",
    "p_active",
    "memory_days",
    "reflection_every_days",
    "llm",
    "out_dir"
  ],
  "additionalProperties": false,
  "patternProperties": {
    "^_": {}
  },
  "allOf": [
    {
      "if": {
        "properties": {
          "mock_llm": {
            "const": true
          }
        },
        "required": [
          "mock_llm"
        ]
      },
      "then": {
        "required": [
          "mock_options"
        ]
      }
    },
    {
      "if": {
        "properties": {
          "modality_run_arm": {
            "const": "T"
          }
        },
        "required": [
          "modality_run_arm"
        ]
      },
      "then": {
        "properties": {
          "modality_arms": {
            "contains": {
              "const": "T"
            }
          }
        }
      }
    },
    {
      "if": {
        "properties": {
          "modality_run_arm": {
            "const": "TC"
          }
        },
        "required": [
          "modality_run_arm"
        ]
      },
      "then": {
        "properties": {
          "modality_arms": {
            "contains": {
              "const": "TC"
            }
          }
        }
      }
    },
    {
      "if": {
        "properties": {
          "modality_run_arm": {
            "const": "TV"
          }
        },
        "required": [
          "modality_run_arm"
        ]
      },
      "then": {
        "properties": {
          "modality_arms": {
            "contains": {
              "const": "TV"
            }
          }
        }
      }
    }
  ]
}
