{
  "run_tag": "mock_10x3",
  "seed": 2027,
  "mock_llm": true,
  "window": {
    "start": "2025-10-01",
    "end": "2025-12-31",
    "max_trading_days": 3
  },
  "n_agents": 10,
  "agents_file": "sim/agents_seed2027.json",
  "orgs": [
    "广发基金",
    "鹏华基金",
    "国联基金",
    "汇添富基金"
  ],
  "content_pool": "sim/content_pool_v1_masked.jsonl",
  "posts_per_org_per_day": 2,
  "no_repeat_days": 10,
  "nav_cache": "sim/nav_cache.json",
  "guba_signal": "sim/guba_signal_v1.json",
  "suitability": true,
  "strategy_mix": "measured",
  "ranking": "three_source",
  "arm_level": "agent",
  "p_image": 0.5,
  "climate_weighting": true,
  "memory": true,
  "social": true,
  "feed": {
    "K": 6,
    "slots": {
      "follow": 2,
      "fit": 2,
      "trending": 2
    },
    "w_trust": 1.0,
    "w_fit": 1.0,
    "w_heat": 1.0,
    "w_soc": 0.5,
    "eps": 0.05,
    "gamma": 1.8
  },
  "p_active": 1.0,
  "memory_days": 5,
  "reflection_every_days": 5,
  "llm": {
    "model": "glm-4.6v",
    "text_model": "glm-4.6v",
    "workers": 4,
    "max_attempts": 3,
    "decision_failure_halt": 0.02,
    "cache": "sim/runs/mock_10x3/llm_cache.jsonl",
    "max_tokens_start": 6144
  },
  "mock_options": {
    "force_c2_r4_click": true,
    "malformed_rate": 0.05
  },
  "out_dir": "sim/runs/mock_10x3",
  "channels": {
    "feed": true,
    "experience": true,
    "trend": false,
    "social": true,
    "news": true,
    "direct": false
  }
}
